{
  "schema_version": 1,
  "case_id": "openlmm-test1-test2-small-config-rerun-v1",
  "tier": "small",
  "dataset": {
    "bundle_id": "openlmm-test1-test2-small-v1",
    "bundle_sha256": "95d1f8c0788e768353b7f43ff0a04b06f8bb4780aa5c2c7ccd72a7492c8b27b8",
    "source": "private-artifact://openlmm-test1-test2-small-v1",
    "license": "LicenseRef-OpenLMM-Internal",
    "redistributable": false,
    "agents": [
      {
        "frames": [
          90,
          91,
          92,
          93,
          94,
          95,
          96,
          97,
          98,
          99,
          100,
          101,
          102,
          103,
          104,
          105,
          106,
          107,
          108,
          109,
          110,
          111,
          112,
          113,
          114,
          115,
          116,
          117,
          118,
          119,
          120,
          121,
          122,
          123,
          124,
          125,
          126,
          127,
          128,
          129,
          130,
          131,
          132,
          133,
          134,
          135,
          136,
          137,
          138,
          139,
          140,
          141,
          142,
          143,
          144,
          145,
          146,
          147,
          148,
          149,
          150,
          151,
          152,
          153,
          154,
          155,
          156,
          157,
          158,
          159,
          160,
          161,
          162,
          163,
          164,
          165,
          166,
          167,
          168,
          169
        ],
        "id": "test1",
        "pose_file": {
          "path": "test1/optimized_poses.txt",
          "sha256": "783722d3c31034c3f3af7425a758d172284938be1c36ca9a599edb7e0bca9929"
        },
        "scan_index": {
          "path": "test1/scans.sha256",
          "sha256": "5c6b9c09fd79eb287ba708e44ce0fbc12a92a0915b5e8dccb3b07199ed688fde"
        }
      },
      {
        "frames": [
          80,
          81,
          82,
          83,
          84,
          85,
          86,
          87,
          88,
          89,
          90,
          91,
          92,
          93,
          94,
          95,
          96,
          97,
          98,
          99,
          100,
          101,
          102,
          103,
          104,
          105,
          106,
          107,
          108,
          109,
          110,
          111,
          112,
          113,
          114,
          115,
          116,
          117,
          118,
          119,
          120,
          121,
          122,
          123,
          124,
          125,
          126,
          127,
          128,
          129,
          130,
          131,
          132,
          133,
          134,
          135,
          136,
          137,
          138,
          139,
          140,
          141,
          142,
          143,
          144,
          145,
          146,
          147,
          148,
          149,
          150,
          151,
          152,
          153,
          154,
          155,
          156,
          157,
          158,
          159
        ],
        "id": "test2",
        "pose_file": {
          "path": "test2/optimized_poses.txt",
          "sha256": "988ae56731a4c83e8a74a88ce47c02bc7f37e428601fd0a83e1caa9497d94e24"
        },
        "scan_index": {
          "path": "test2/scans.sha256",
          "sha256": "2ef3021366ccf922f91811e97769351116dce7add04eef1965bb7c427effaffb"
        }
      }
    ]
  },
  "provenance": {
    "acquired_at": "not-recorded",
    "source_version": "openlmm-test1-test2-source-v1",
    "attribution_file": "ATTRIBUTION.md",
    "transformations": [
      "exact source frame and matching pose-row selection",
      "deterministic archive metadata normalization",
      "no PCD filtering, resampling, or payload rewrite"
    ],
    "original_sha256": "3bb9aeb46d08b2adfecad3319254ab716cc884547dce9e73bd9c281ca3bf5c79"
  },
  "config": {
    "root": "config.json",
    "files": [
      {
        "path": "config.json",
        "sha256": "dad3d88480d7c5ee24241cec469daaa165b851c0fbc742ee0e67c7f7d5e5a01f"
      },
      {
        "path": "server/config_map_server.json",
        "sha256": "7d874a625ae66b7de080c83a93153ccd7d7ad111bb4cf4546b885670d0d314a3"
      },
      {
        "path": "core/data_loader/file_based.json",
        "sha256": "fae8986f7e7f8e34205644b9f5e7a46cea5e6c5d9c8fed9910ec0b7937899be5"
      },
      {
        "path": "core/loop_detector/scan_context.json",
        "sha256": "03bbad2d103a73afe188f375afed12fdd41b27f7cb4d64e66df721ca9ce6dc81"
      },
      {
        "path": "core/backend_optimizer/incremental.json",
        "sha256": "95c2721c9970bfb979879aebda7abce553e33be03b281b8b1686d558a72480b7"
      },
      {
        "path": "core/dynamic_remover/hmm_mos.json",
        "sha256": "5f19eadebdb82bdea384c730fa2aaebb61d9e06c35f771a20f105d023a23e02f"
      },
      {
        "path": "core/loop_detector/scan_context_rerun.json",
        "sha256": "de48b9aee7ea03775104c4a75908976124f5f2a833b478371ec94cd6ed4a3693"
      }
    ],
    "plugins": [
      {
        "kind": "descriptor",
        "id": "scan_context",
        "capability": "descriptor:kdtree"
      },
      {
        "kind": "dynamic_remover_online",
        "id": "hmm_mos",
        "capability": "dynamic_remover:online"
      }
    ]
  },
  "workflow": [
    {
      "stage": "DataLoad",
      "agents": "all"
    },
    {
      "stage": "Alignment",
      "agents": "all"
    },
    {
      "stage": "MapUpdate",
      "agents": "all"
    },
    {
      "stage": "Save",
      "agents": "all"
    },
    {
      "stage": "ApplyConfig",
      "agents": "all",
      "config_change": {
        "domain": "loop_detector",
        "document": "core/loop_detector/scan_context_rerun.json",
        "selected_document": "core/loop_detector/scan_context_rerun.json"
      }
    },
    {
      "stage": "DataLoad",
      "agents": "all"
    },
    {
      "stage": "Alignment",
      "agents": "all"
    },
    {
      "stage": "MapUpdate",
      "agents": "all"
    },
    {
      "stage": "Save",
      "agents": "all"
    }
  ],
  "expected": {
    "result": "success",
    "baseline_id": "openlmm-test1-test2-small-config-rerun-baseline-v1"
  },
  "tolerances": {
    "pose_translation_m": 0.001,
    "pose_rotation_rad": 0.0001,
    "map_point_count_ratio": 0.01,
    "map_bounds_m": 0.05
  }
}
